{
  "format_version": "0.2.0",
  "report_id": "c81ed141-39b1-40a5-ab70-5b4b32601da0",
  "generated_at": "2026-10-31T12:29:46.592Z",
  "subject": {
    "server_name": "io.github.upstash/context7",
    "publisher_claim": "@upstash",
    "artifact": {
      "ecosystem": "npm",
      "package": "@upstash/context7-mcp",
      "version": "4.4.4",
      "sha256": "2ae37c3a2b41ff4d591a275ff1dc56883cb60bfc71e34c399c14ebd38837bb38",
      "download_url": "https://registry.npmjs.org/@upstash/context7-mcp/-/context7-mcp-4.4.4.tgz",
      "registry_metadata_url": "https://registry.npmjs.org/%40upstash%2Fcontext7-mcp/4.4.4",
      "acquired_at": "2026-10-31T12:29:46.539Z",
      "registry_metadata_sha256": "49ed4d3212fe7d23967fc9dbea75307755ba54de3863864608b8218360fd28e4",
      "integrity_claim": "sha512-T2DkjhweDnC2mRAclDiTrPG3KI1zYKhhjgY2SMKD9PVrbEaGD8x35VsIOqpwwDc2qiKBvfYCF/jqr+jQMu5PUA==",
      "integrity_verified": true
    }
  },
  "analysis": {
    "engine": {
      "name": "sentinel",
      "version": "0.2.0",
      "build_sha256": "ed6f4bcb8c0ad7e6ef63f07a0aad92e382379bd04f02a53fb9eb8688f38a1eb9"
    },
    "protocol_profile": {
      "id": "mcp-2026-07-28",
      "specification_revision": "2026-07-28",
      "local_retrieval_date": "2026-08-01",
      "discovery_status": "not_run"
    },
    "authorization_profiles": [
      {
        "id": "none",
        "credential_present": false,
        "description": "No credentials were supplied."
      }
    ],
    "rule_pack": {
      "version": "0.1.0",
      "sha256": "302d85219dda34199bd2402fcc94ba34233152fe996a128e0b332ac3efef24b3"
    },
    "semantic_analysis": []
  },
  "observations": [
    {
      "id": "observation:package-metadata",
      "kind": "artifact_metadata",
      "coverage": "declared",
      "evidence": [
        {
          "sha256": "3b07c651e858c9c164a7a55d497d143f4f69c17060bbb20f11980b7e341f0644",
          "artifact_path": "package/package.json",
          "capture_kind": "artifact_file"
        }
      ],
      "data": {
        "name": "@upstash/context7-mcp",
        "version": "4.4.4",
        "mcpName": "io.github.upstash/context7",
        "description": "MCP server for Context7",
        "bin": {
          "context7-mcp": "dist/index.js"
        },
        "scripts": {
          "build": "tsc && chmod 755 dist/index.js",
          "test": "pnpm exec vitest run",
          "typecheck": "tsc --noEmit",
          "lint": "eslint .",
          "lint:check": "eslint .",
          "format": "prettier --write .",
          "format:check": "prettier --check .",
          "dev": "tsc --watch",
          "start": "node dist/index.js --transport http",
          "build:mcpb": "esbuild src/index.ts --bundle --platform=node --target=node20 --format=esm --outfile=mcpb/stage/server/dist/index.mjs --banner:js=\"import { createRequire } from 'node:module'; const require = createRequire(import.meta.url);\"",
          "pack-mcpb": "rm -rf mcpb/stage && pnpm run build:mcpb && cp package.json mcpb/stage/package.json && cp mcpb/manifest.json mcpb/stage/manifest.json && cp ../../public/icon.png mcpb/stage/icon.png && mcpb validate mcpb/stage/manifest.json && mcpb pack mcpb/stage mcpb/context7.mcpb && rm -rf mcpb/stage"
        },
        "engines": {
          "node": ">=20.18.1"
        }
      }
    },
    {
      "id": "observation:file-inventory",
      "kind": "file",
      "coverage": "declared",
      "evidence": [
        {
          "sha256": "2ae37c3a2b41ff4d591a275ff1dc56883cb60bfc71e34c399c14ebd38837bb38",
          "capture_kind": "artifact_file"
        }
      ],
      "data": {
        "entry_count": 29,
        "regular_file_bytes": 214143,
        "entries": [
          {
            "path": "package/dist/index.js",
            "type": "file",
            "size": 36459,
            "sha256": "05aa837e6586447e02fcd97a13f992e4f625efa8498371610a82cea6d235eccc"
          },
          {
            "path": "package/dist/lib/api.js",
            "type": "file",
            "size": 7913,
            "sha256": "28546e960ad4b120ad71253487164162792868342ee9e325279796c93c624aef"
          },
          {
            "path": "package/dist/lib/auth-lifecycle-telemetry.js",
            "type": "file",
            "size": 1450,
            "sha256": "ee7ee5c418ecfdf9fc1327d859c4eeff889f33b3ca3bbbb676b3e643964e8ff8"
          },
          {
            "path": "package/dist/lib/auth/auth-prompt.js",
            "type": "file",
            "size": 4162,
            "sha256": "9d6ef90e4a7cb750b6502dba7eb1ba4bd7236379d724bbd164ef70982e696460"
          },
          {
            "path": "package/dist/lib/constants.js",
            "type": "file",
            "size": 3588,
            "sha256": "b89cc68c19ddd64255b369e52f09cb19a0ccb27498f7a38ecc6501831b6f3de2"
          },
          {
            "path": "package/dist/lib/encryption.js",
            "type": "file",
            "size": 2823,
            "sha256": "8e949eb881dbcecca19c1cf88fa18ca0d2d991823361f1471d5e9143ac4fcd10"
          },
          {
            "path": "package/dist/lib/jwt.js",
            "type": "file",
            "size": 8901,
            "sha256": "05dffc4cfb9059cf0bdff5435dd715e5261ad0ff95c0bd4386f70527ba6a7b5a"
          },
          {
            "path": "package/dist/lib/log-throttle.js",
            "type": "file",
            "size": 958,
            "sha256": "0b13ffb116df5f16fcae1d1a09177ace4528272d366086996a728b4a239c5522"
          },
          {
            "path": "package/dist/lib/mcp-body-error-handler.js",
            "type": "file",
            "size": 1276,
            "sha256": "c7f9fdea91bbab6c88789de35a34a962b3d4e8bd914f7719e64cbcc1bbbad7d0"
          },
          {
            "path": "package/dist/lib/mcp-http-auth.js",
            "type": "file",
            "size": 7061,
            "sha256": "671d9c2a0ae6b2260880d6bdf7eccab5d06363f271e2fc8759108a16f3021def"
          },
          {
            "path": "package/dist/lib/mcp-operation-scope.js",
            "type": "file",
            "size": 542,
            "sha256": "2e760473829e37d412cdc14ad94474bee1f1b56a66e6e78c59d4afd340899cbc"
          },
          {
            "path": "package/dist/lib/mcp-route.js",
            "type": "file",
            "size": 201,
            "sha256": "7cd0ea2c309601c18a8fac5a2082bb3bafe7181d9db38e30b0dc7205feb3d487"
          },
          {
            "path": "package/dist/lib/mcp-subscription-telemetry.js",
            "type": "file",
            "size": 19329,
            "sha256": "ca2e94ee248cec99cde0b77c00ec39d9dfbec9a3714fcfd93cf2ef972c284a51"
          },
          {
            "path": "package/dist/lib/mcp-telemetry.js",
            "type": "file",
            "size": 23512,
            "sha256": "5888da0da429e004754b2674fa422214f77ff6c76fed6d51004f1585c8715f6a"
          },
          {
            "path": "package/dist/lib/oauth-audience.js",
            "type": "file",
            "size": 5097,
            "sha256": "25430360fb4228e66f63c174d3151f52953015724cb62eaf0757b2bf81039e96"
          },
          {
            "path": "package/dist/lib/oauth-token-validation.js",
            "type": "file",
            "size": 5806,
            "sha256": "2e536598497f8ed277c7ab585393863a88f5013eb7a45ce16578db0aced5758d"
          },
          {
            "path": "package/dist/lib/process-shutdown.js",
            "type": "file",
            "size": 2077,
            "sha256": "59688a21a4b5b3ba548b01a381dc9ad622c80937079f390c74e84a663d84fb43"
          },
          {
            "path": "package/dist/lib/telemetry-config.js",
            "type": "file",
            "size": 535,
            "sha256": "c1d4f2346fd3e7e911dbbe15c3de531f37dea0b570c3ec4a0f55a86856fa5e87"
          },
          {
            "path": "package/dist/lib/telemetry-contracts.js",
            "type": "file",
            "size": 11,
            "sha256": "8e609bb71c20b858c77f0e9f90bb1319db8477b13f9f965f1a1e18524bf50881"
          },
          {
            "path": "package/dist/lib/telemetry-provider.js",
            "type": "file",
            "size": 3455,
            "sha256": "7e5b740b3b266fea10f0cfcb2379bbf8e8b5ba0a161fe9b17fb7b86cd9129df5"
          },
          {
            "path": "package/dist/lib/telemetry-runtime.js",
            "type": "file",
            "size": 2816,
            "sha256": "03a97fd314a162073682efce971387ff5a84c3eab51a982b4648eaeeb4def664"
          },
          {
            "path": "package/dist/lib/telemetry.js",
            "type": "file",
            "size": 9704,
            "sha256": "fbc872d99436144c503c8fb98ef7da1f82ff8422435bece39b637cc5051d94ce"
          },
          {
            "path": "package/dist/lib/tool-names.js",
            "type": "file",
            "size": 180,
            "sha256": "57422b59138db769769f92b902c854d131d0a513b4fb0cb8b7fbf5c9fd229b82"
          },
          {
            "path": "package/dist/lib/types.js",
            "type": "file",
            "size": 11,
            "sha256": "8e609bb71c20b858c77f0e9f90bb1319db8477b13f9f965f1a1e18524bf50881"
          },
          {
            "path": "package/dist/lib/utils.js",
            "type": "file",
            "size": 3942,
            "sha256": "edeb5a9e74a8e4c81e6072b4830c31d050c5bca2045aa6b84c140778d8c0dd77"
          },
          {
            "path": "package/dist/lib/vercelMarketplaceJwt.js",
            "type": "file",
            "size": 1925,
            "sha256": "a26a5e5e88de60ff3ac9b00c7726a4bfdb26417e89386f4968b7236998841063"
          },
          {
            "path": "package/LICENSE",
            "type": "file",
            "size": 1079,
            "sha256": "85cfb556dc2b22b55d2565674fcdaac82f3f2f6b7a928d27003132721bb6736c"
          },
          {
            "path": "package/package.json",
            "type": "file",
            "size": 2509,
            "sha256": "3b07c651e858c9c164a7a55d497d143f4f69c17060bbb20f11980b7e341f0644"
          },
          {